{
  "schema_version": 1,
  "id": "com.cyrene.service.catalyst",
  "name": "Catalyst",
  "service": "catalyst",
  "visibility": "private",
  "distribution": "advanced-service-plugin",
  "status": "preserved-source",
  "core": {
    "protocol_version": 1,
    "minimum_core_version": "0.1.0",
    "extension_points": ["data.prepare"]
  },
  "source_roots": ["."]
}
